review_id,text,label,platform,date
R0001,ถ่ายรูปออกมาแล้วสวยจริงครับ,1,facebook,5/24/2022
R0002,ผมชอบบรรยากาศทิวทัศน์ของ เลอบัว,1,facebook,2/11/2025
R0003,อยากไปบ้างจังนะ.,1,facebook,4/19/2025
R0004,ชอบค่ะ,1,facebook,2/20/2025
R0005,ชอบมากครับเหมือนกันอ่ะครับ,1,facebook,2/19/2024
R0006,"เมื่อไหร่ได้ไปเที่ยวใช้ชีวิตคุ้มค่ากับความหรูหราแบบนี้กี่เรื่องกี่อย่างเช่นรถ,บ้าน,อาหาร,เสื้อผ้ารอถึงวันนี้กี่สิบปีแล้วฯลฯคล้ายกับเศรษฐีคนอื่นเขาบ้าง.",1,facebook,3/23/2023
R0007,จากประสบการณ์ส่วนตัว คิดว่าถ้านับเฉพาะวิวจากห้องพัก วิวด้านทิศเหนือของบันทรี กรุงเทพฯคือดีที่สุด แต่วิวที่ดีที่สุดยกให้ roof top ของตึกมหานคร กับ Vertigo and Moon Bar ของบันยันทรีเช่นกันครับ,1,facebook,9/2/2024
R0008,ว้าว,1,facebook,3/15/2023
R0009,วิวดี จะติดต่อได้ที่เบอรอะไรคะ,1,facebook,7/24/2019
R0010,สวยค่ะอันนี้โรงแรม5ดาวกรุงเทพฯเปล่าคะ,1,facebook,4/25/2023
R0011,"ชอบมากครับอยากไปบ้างเหมือนกันจังครับเอ้ห้องแบบไหนราคาเท่าไหร่บ้างนะอ๋อสภาพเหมือนบ้านพ่อแม่ครับโรงแรมเกือบทั้งหมดนี้ถ้ายังไม่หยุดจองเวรจองกรรมเช่นในข้อความลาย,หนูหิ่นฯลฯ.",1,facebook,8/31/2019
R0012,อ๋อไฟฟ้าเน็ตและชุดใหญ่ไฟกระพริบวันละ๓หมื่นครั้งเกือบ24ชั่วโมงเกือบตลอดไป.,1,facebook,7/10/2024
R0013,"ถ้าผมรวย... ไม่ขอมีบ้าน​ อยู่แต่โรงแรม
ขี้เกียจทำงานบ้าน​",1,facebook,4/14/2025
R0014,โรงแรมเพนนินซูล่าสวย,1,facebook,9/4/2021
R0015,แชงกรีลา อยู่ระนาบเดียวกันกับ โอเรียลเต็ล แต่ไม่ติด แปลก ๆ ดี,1,facebook,1/28/2025
R0016,อยากให้ทุกโรงแรม ให้พนักงาน แต่งชุดไทย ที่มีสไบ ทุกวัน อาทิตย์ หรือทุกวันได้ ยิ่งดี พนักงานชาย ชุดราชปะแตน หรือชุดชายไทยอื่นๆ,1,facebook,11/18/2022
R0017,แพงเกินสามพันสวยแค่ไหนก็ไม่พัก,1,facebook,8/14/2022
R0018,เพิ่งกลับมาเหมือนกันค่ะ รอบนี้เราพักโซนทาวสแควร์ ชอบมาก ๆ ทั้งครอบครัวเลยค่ะ วิวสวย อากาศดี ลูกไถจักรยานสนุกมาก เดือนหน้ามีแพลนจะไปอีก,1,facebook,11/7/2024
R0019,สอบถามหน่อยค่ะอันนี้จองกับทางโรงแรมหรือว่าผ่านแอพ agoda / traveloka คะ,1,facebook,2/22/2024
R0020,"เป็นโรงแรมที่ชอบมาก อากาศดี วิวสวย มาหลายครั้งก็ยังอยากไปพักอีกครับ

https://scontent.fbkk8-4.fna.fbcdn.net/v/t39.30808-6/476840924_3506088149523836_5066575992468443194_n.jpg?stp=dst-jpg_s261x260_tt6&_nc_cat=100&ccb=1-7&_nc_sid=bd9a62&_nc_ohc=Sd2tpzl-jVYQ7kNvwE4nXUC&_nc_oc=AdnWKDC4BAowVjW4OriKl38X8pSSyBLiYP8aYIA_PC-X5E7wJEj5dkaJdCj1BvHtCPpxA_nAElVeCun_eDwaYauG&_nc_zt=23&_nc_ht=scontent.fbkk8-4.fna&_nc_gid=3P2L-af4hH9M1pefWxSqvw&oh=00_AfGi_QaKfutGgyrjwmcE_v03ige4nFmMx4YIoboCzIIS7w&oe=681849A4",1,facebook,2/27/2024
R0021,สวยจริงค่ะ แต่ล่าสุดที่เราไปเมื่อเดือนก่อน นอนห้อง pool villa ห้องสกปรกมาก เพิ่งเชคอินก็เศษผมเต็มพื้นเลย เหมือนทำความสะอาดไม่เรียบร้อย กองผ้าที่เพิ่งเปลี่ยนก็กองอยู่ข้างหน้า แถมเจอแมลงสาปในตู้เซฟอีก 🥲,1,facebook,1/4/2023
R0022,ที่นี่ดีทุกอย่างนะครับ แต่อาหารเช้าคือ ไม่ค่อยประทับใจ (ผมทานไกล้ๆ ที่พัก ลาคาเซทต้า) ( ไม่หลากหลาย และรสชาติ เฉยๆ ) แต่อย่างอื่นคือ เต็ม10 จริงๆ บรรยากาศกลางคืน,1,facebook,7/11/2024
R0023,เพิ่งไปพักโซนนี้มาช่วงเดือนกันยารู้สึกว่าอาหารเช้ารสชาติไม่ว้าวเหมือนกันค่ะ แล้วพนักงานแอบละเลยแขกไปนิดนึง ตอนออกเกือบโดนชาร์จค่าminibarในห้องทั้งที่ไม่ได้กิน แต่ห้องพักกับบรรยากาศคือดีเลยค่ะ,1,facebook,3/24/2020
R0024,"เราไปพักโซนวิลล่ามา 2 คืนค่ะ
เบ็ดเสร็จเฉพาะค่าที่พักก็ 47,000 นิดๆ เราคิดว่า จ่ายราคาขนาดนี้ น่าจะมีบริการหรืออ๊อฟชั่นเสริมอะไรให้บ้าง

เราไม่ประทับใจการบริการค่ะ
พนักงานไม่ค่อยบริการอะไรใดๆเลย
อาหารเช้าธรรมดามากๆ มากๆจริงๆค่ะ มีให้เลือกน้อย
เราให้คะแนนเต็ม 10 แค่เรื่องวิว + ที่พักไม่โทรม สวยค่ะ

ตอนเราไปเช็คเอาท์ มีแขกที่ไม่รู้ว่ามีการคิดค่าบริการรถกอล์ฟด้วย โดนไปเท่าไหร่ไม่แน่ใจ แขกก็ไม่ค่อยพอใจอยู่เหมือนกันค่ะ แต่ก็ยอมจ่ายๆไป เพราะไม่น่ามีพนักงานแจ้งว่ามีค่าใช้จ่ายด้วย มารู้ทีหลัง

แต่เรื่องวิว เราให้คะแนนเต็มสิบค่ะ",1,facebook,4/13/2022
R0025,Rattana มาดูๆๆ รีวิวทอสคาน่า,1,facebook,4/17/2025
R0026,สวยงาม น่าไปพักมากครับ,1,facebook,1/15/2025
R0027,รีวิวน่ารัก ภาพสวยมากค่ะ,1,facebook,5/19/2023
R0028,จองที่พักได้ที่ไหนคะ จองตรงไหมคะ,1,facebook,7/22/2024
R0029,ร้านอาหารคนเยอะมากจริงค่ะ เราพักที่ทาวสแควร์ ดีที่เขาจัดโต๊ะด้านนอกไว้เยอะมาก แต่ก็ต้องหลีกเวลาคนเยอะค่ะ ไปทานช่วงเกือบ 10 โมงแล้ว เพราะช่วงนี้คน 80% ของโรงแรมเลย คนไทยอยากเที่ยวมาก,1,facebook,8/6/2018
R0030,รร.นี้ลูกสาวชอบมากค่ะ 18-20​ ต.ค.​นี้ก้อจะไปอีกรอบค่ะ​ ใกล้บ้านบรรยากาศ​ดี​,1,facebook,1/29/2024
R0031,เก๊าอยากไปอีก รีวิวก็บอกว่าดี,1,facebook,12/6/2020
R0032,มาดูๆๆ รีวิวทอสคาน่าค่ะ อีก 1 ตัวเลือก,1,facebook,10/27/2024
R0033,วิวสวยยยย,1,facebook,2/9/2020
R0034,แต่เราไปมา โซนในสุดพนักงานต้อนรับ พูดจาไม่ดีกับลูกค้าเลย และห้องพักโรงแรมฝุ่นเยอะมากค่ะ,1,facebook,9/24/2022
R0035,เราชอบมากเลยค่ะปั่นจักรยานที่นี่ รู้สึกไม่เหมือนอยู่ในไทยเลย วิวดีมากๆ,1,facebook,3/20/2019
R0036,วันนี้ถูกหวยจองเลย,1,facebook,11/22/2023
R0037,"วิวสนามเด็กเล่นก็สวยค่ะ 
ไป2วันถ่ายรูปไม่หมด อดปั่นจักรยาน คราวหน้าค้องไม่พลาดแน่ค่ะ

https://scontent.fbkk12-4.fna.fbcdn.net/v/t39.30808-6/481076131_23965599389707389_7585287136420871993_n.jpg?stp=dst-jpg_s261x260_tt6&_nc_cat=103&ccb=1-7&_nc_sid=bd9a62&_nc_ohc=Zqm32vnva2sQ7kNvwHMTJlA&_nc_oc=AdllDo8_2DzvSYpE8xBsUfMxanOwET3THFF66hHAEcTNDEicdMTN06MoriJUnV99UjWbKON5WakM7PIIIHAM5K3m&_nc_zt=23&_nc_ht=scontent.fbkk12-4.fna&_nc_gid=dPBMVCJD8wE0aAlFtob1Lw&oh=00_AfGWpH_ocSEsmngw0nl-gkHuQ7NcsFvBlb9eC-LXUzI04g&oe=68184562",1,facebook,8/27/2023
R0038,ชอบอาหารเช้าบุฟเฟ่ย์555,1,facebook,2/19/2024
R0039,เป็นโรงแรมที่วิวสวยและเงียบสงบมากเหมาะกับการพักผ่อนจริงๆค่ะ,1,facebook,6/16/2020
R0040,ให้บรรยากาศเมืองนอกมาก555,1,facebook,1/16/2020
R0041,จองละนะ,1,facebook,2/22/2021
R0042,ชอบรีวิวแบบนี้มากครับ,1,facebook,7/21/2021
R0043,ปักหมุดดด วิวเหมือนอยู่ ตปท.,1,facebook,2/17/2025
R0044,ก่อนปีใหม่ไปจิบไวน์บรรยากาศดีๆกันไหม,1,facebook,4/3/2020
R0045,ที่ปั่นจักรยานวิวสวยมากกกก,1,facebook,3/15/2021
R0046,อันนี้มีปั่นจักรยานแบบชิว วิวสวยมากก,0,facebook,4/14/2023
R0047,สวยมากบรรยากาศดีมากๆเลย,1,facebook,2/23/2024
R0048,ขออนุญาตสอบถามถ้าหากไปถ่ายรูปชมวิว โดยไม่ได้เข้าพักสามารทำได้รึเปล่าครับ,1,facebook,11/17/2023
R0049,ชอบทุกอย่างบกเว้นอาหารเช้าอีกเสียงค่ะ มีให้เลือกทานน้อย ห้องอาหารเล็ก,1,facebook,12/24/2024
R0050,February Sine บรรยากาศดี,1,facebook,10/19/2023
R0051,เกินบรรยาย,1,facebook,2/20/2019
R0052,ติดอย่างเดียวอาหารเช้าเฉยๆมาก,1,facebook,8/19/2021
R0053,ไปพักที่นี่สองครั้งแล้วค่ะ ชอบพื้นที่ของเค้าและความเป็นอิสระของการเข้าพักที่นี่ค่ะ,1,facebook,3/10/2021
R0054,สวยมากๆเลยค่ะ รีวิวได้สวยมาก ทำให้อยากไปเลยค่ะ,1,facebook,7/8/2018
R0055,"วิวดีมากจริงๆค่ะ

https://scontent.fbkk8-4.fna.fbcdn.net/v/t39.30808-6/470170677_1483287872629150_8914737837191901800_n.jpg?stp=dst-jpg_s261x260_tt6&_nc_cat=100&ccb=1-7&_nc_sid=bd9a62&_nc_ohc=niwq0-UbrfIQ7kNvwFtabnX&_nc_oc=Adl6KdFj1hYMYZMVOhv2u1cbmuSkxS63ffWK8xmmw4mvfbXGBRv4Wvdv14vpPJCdnKnwCX5PPD4XflGEdDftYdrq&_nc_zt=23&_nc_ht=scontent.fbkk8-4.fna&_nc_gid=HweCT7rpNGCYccHfJMDKPQ&oh=00_AfFj89XfohPQVxY9MYC3woe-wev0osC_2lnsPEdLGEBiAQ&oe=681832CC",1,facebook,2/3/2023
R0056,มีเช็คความปลอดภัยโควิดก่อนเข้าพักมั้ยคะ เช่นดูวัคซีนหรือตรวจatk มั้ยคะ,1,facebook,11/15/2020
R0057,สอบถามค่ะ จองผ่านแอพอะไรไปค่ะ,1,facebook,8/20/2024
R0058,Mintt Kanyaratอยากปั่นจักรยาน วิวดี,1,facebook,8/20/2023
R0059,... มื้ออาหารอื่นจองโต๊ะแทบไม่ได้ คิวเวลายาว เลยสั่งมาทานในห้องแทน คนทานที่โรงแรมเยอะมากๆ ช่วงนี้ ... เราซื้อคูปองไว้สองปีก่อน เจอการปิดโรงแรมเพราะโควิด เพิ่งมาเปิดเลยได้ใช้,1,facebook,9/5/2020
R0060,ตอนนี้มีเราเที่ยวด้วยกันราคาถูกลงไปอีก คนเลยน่าจะยิ่งเยอะขึ้น ที่นี่โชคดีสถานที่กว้างขวางค่ะ แต่จะห่วงตรงจุดห้องอาหารที่คนแออัดนี่แหละ,1,facebook,5/1/2021
R0061,ทุกอย่างแสงเหลืองนวลไปหมด เหมือนหลุดไปอีกโลกเลย ประทับใจมากๆๆๆๆๆ,1,facebook,3/13/2021
R0062,คนมาฮิตที่นี่เพราะอยากได้ธรรมชาติกัน,0,facebook,4/12/2024
R0063,กิจกรรมคนรวยคนพอมีพอกินแบบเราเอื้อมไม่ถึงหรอก เหอะๆ,1,facebook,1/20/2025
R0064,เราว่าราคาก็สมเหตุสมผลนะ ก็ไม่ได้แพงอะไรมากสำหรับคนมีตังค์นะ เค้าคงวางตลาดไว้แล้วว่าจะจับลูกค้ากลุ่มไหน,1,facebook,10/30/2020
R0065,สวยดี เหมือนต่างประเทศเลย แต่อากาศคงไม่ได้อะ บ้านเราร้อนตับแตก แถมราคาแอบแพงงงง หลักหมื่นขนาดนี้ไปต่างประเทศคุ้มกว่านะ,1,facebook,1/30/2022
R0066,ดูสวยอยู่แต่แบบปลอมๆอ่ะ ทัวร์ตปท.เด๋วนี้ถูกมาก กิน พัก เดินทางรวมทุกอย่าง ลองหาดูดีๆ อาจจ่ายถูกกว่าไปเอง ทำมาแล้วทุกแบบ ทัวร์กับบริษัทนำเที่ยวถูกใจ ถูกตังค์สุดแล้ว,1,facebook,9/3/2021
R0067,"Toscana คือสวยจริง ๆ แบบเหมือนไม่อยู่ไทย 
ถ้าอากาศเย็นนี้คงสุดมากกว่านี้",1,facebook,9/12/2024
R0068,ราคาแบบนีเก็บเงินไปยุโรปดีกว่าพักได้นะแต่ไม่อะ,1,facebook,7/31/2022
R0069,ทั้งแม่นำ้และภูเขาที่เป็นสาธารณะ​สมบัติ​ของชาติ​ถูก​นายทุน​ฉวยโอกาส​เป็น​เจ้าของ.. เห็น​แล้วเศร้าใจ.อนุมัติ​ให้​สร้าง​ได้ไง​ มีเงินยังไงก็​ไม่​ขอไปพักค่ะ,1,facebook,2/21/2020
R0070,ตลกกกกกกก ที่พักสไตล์โมรอคโค แต่ใส่ส่าหรี่ 555555+,1,facebook,2/20/2019
R0071,ขอไปเขาใหญ่ละกัน แต่ไปพักที่วังน้ำเขียวถูกฝ่ากันเยอะเลย,1,facebook,10/21/2022
R0072,อมัน ยูนิค ไปพักมาแล้ว สวยมากครับ ราคาไม่แพง มีรถรับส่งฟรีจากสถานที่สำคัญๆทั่วเมืองอุดรฯครับ,1,facebook,7/20/2021
R0073,แพงวันเดียวค่าพักค่ากินค่าอยุ่ค่านุ่นี้นั้นหลายย่าง ปาไปเกียบ2หมื่อนล่ะมังนิไป ต ป ท เสียที่เดียวจบถูกด้วยอากาสบรรยกาศจิงฟินกว่า ไปกับทัวร์ เป็นอาทิตย์,1,facebook,10/24/2021
R0074,เอาที่หลวง มาทำที่พักเฉย ทั้งแม่น้ำ ทั้งภูเขา ไม่เห็นเจ้าหน้าที่รัฐมาจัดการไร คนรวยทำไรก็ได้นะประเทศนี้,1,facebook,4/12/2023
R0075,ชอบน่ะมีแหล่งท่องเที่ยว..แต่ที่ไม่ชอบ คือ มันสร้างได้ยังไงในแหล่งป่าและธรรมชาติ ในน้ำอีก ที่ดินมันซื้อขายกันได้ด้วยหรอ เข้าไปครอบครองแบบนั้นได้ยังไงใครเป็นคนกำหนดให้เข้าไปใช้พื้นที่นั้นๆ.ถ้ารัฐบาลเข้าไปลงทุนเองก็ว่าไปอย่าง.แล้วที่สำคัญ หากินกับธรรมชาติและอยู่ในประเทศตัวเองแท้ๆดันตั้งราคาสะโอเวอ เที่ยวของแท้ไม่เห็นแพงขนาดนี้เลย.,1,facebook,12/14/2020
R0076,โอัแม่เจ้า ค่าที่พักบางแห่งแพงยิ่ง กว่าไปเที่ยวญี่ปุ่น5วันเสียอีก ไปเที่ยวต่างประเทศไม่ดีกว่าเหรอ เอาไว้ให้เจ้าของมันพักเองเหอะ.,1,facebook,1/10/2023
R0077,สวยทุกที่ น่าไปทุกที่,1,facebook,4/18/2023
R0078,ได้ยินว่าถ้ารถติดมากถ้าไป,1,facebook,5/12/2022
R0079,ไปเจอช่วงสวยก็สวย เจอช่วงปรับปรุงก็จ๋อยเลย ไปอาน่าตุลาที่ผ่านมา เอิ่ม สระว่ายน้ำกลางสวนน้ำบอกเลยขุ่นฝุ่นลอยน่าสยองมาก สระบนก็ปิดปรับปรุง แต่ก็ยังมี นั่งเรือขมหิ่งห้อยฟรี เรือพายฟรี ถ้าปรับปรุงดีๆ สวยยุน่ะ,1,facebook,5/14/2024
R0080,สวยสุดๆน่าพักมากมาย..ไม่อยากเชื่อเลยว่าเมืองไทยเราที่พักสวยๆเช่นนี้...คนออกเเบบเก่งมากๆใช้ความเป็นศิลปความคิดสร้างสรรค์ออกเเบบได้โดดเด่นมากๆ,1,facebook,7/19/2022
R0081,สวยทุกที่ค่ะ,1,facebook,10/12/2020
R0082,สวยงามมากมายทุกที่น่ามาเยือนค่ะ,1,facebook,8/23/2025
R0083,ไปเที่ยว​เมือง​กาญจน์​ทุกปีเปลี่ยบที่พักผ่อน​ไปเรื่อยจองจากงานท่องเที่ยวไทยราคาพิเศษ​สุด​ๆ,1,facebook,7/8/2021
R0084,สวยจริง เเต่บรรยากาศไม่ได้,1,facebook,9/19/2022
R0085,สดชื่นมากๆ....,1,facebook,3/15/2021
R0086,สวยงามทุกที่ค่ะ,1,facebook,1/23/2018
R0087,ยอดเยี่ยมมากๆๆ,1,facebook,12/5/2023
R0088,สวยงามจริงๆครับ อยากไปที่พัก กาญจนบุรีจริงๆ ชอบครับ,1,facebook,8/20/2023
R0089,เอาจริงๆ จ่ายครั้งเดียวจบ กินเที่ยวเกือบอาทิตย์​ ถ้าไปเองยิ่งถูกมากๆหาข้อมูลดีๆจองบินล่วงหน้า​ ถ้าอยากได้ฟีลสวิสไปจอร์เจียฟรีวีซ่า​ค่าครองชีพถูกพอกะไทย​,1,facebook,10/23/2020
R0090,สวยงามมากคะขอบคุณ,1,facebook,10/23/2020
R0091,เหมือนคะ ราคากะเหมือนกับไปตปท.เหมือนกันเลยคะ,1,facebook,7/4/2022
R0092,ขอบคุณวิดีโอที่ดีครับสวยงามมากๆ,1,facebook,11/3/2024
R0093,สวยค่ะ,1,facebook,11/18/2023
R0094,ชอบตัดต่อภาพแบบนี้จัง,1,facebook,2/8/2022
R0095,สวยมากเลยค่ะ,1,facebook,9/19/2021
R0096,สุดยอด,1,facebook,1/3/2024
R0097,สวยจังเลย,1,facebook,2/22/2024
R0098,เยื่ยมมากค่ะ,1,facebook,11/28/2023
R0099,คนรวยซื้อ คนรวยสร้าง ให้คนรวยเที่ยว!!!!,1,facebook,8/25/2019
R0100,บรรยากาศดีมากครับ,1,facebook,3/3/2020
