review_id,text,label,platform,date
R0675,อยู่ในซอยค่อนข้างลึก แต่มีบริการเรียกมอเตอร์ไซด์และแท็กซี่ ห้องพักมองเผินๆถือว่าสะอาด แต่พอเข้านอนถึงเห็นผ้าห่มผ้าปูที่นอน ยังมีคราบสกปรก เป็นรอยหลายจุดมาก ไม่แน่ใจว่าซักไม่สะอาดหรือไม่ได้ซัก ห้องน้ำสะอาด มีไดร์เป่าผม มีปลั๊กไฟหัวเตียง พนักงานต้อนรับบริการยังไม่ประทับใจค่ะ,0,facebook,1/8/2018
R0676,พักกัน 4 คน จึงเลือกห้องที่มี 2 เตียงเตียงใหญ่ เตียงสองชั้น หน้าต่างอยู่ฝั่งที่ช่วงบ่ายดวงอาทิตย์ส่องพอดี ผ้าม่านก็เอาไม่อยู่ ห้องจะร้อน แอร์ก็ทำงานหนัก เย็นช้า ในห้องก็มี ทีวีเป็นแบบเคเบิ้ล ภาพไม่ค่อยชัด มีตู้เย็นตู้เล็ก,1,facebook,6/26/2023
R0677,พนักไม่มีมารยาทมากค่ะ บริการแย่ แม่บ้านมีคนนึงเราคุยกับเพื่อนอยู่ดีๆพูดแทรกมาตอนกำลังทำห้อง ผ้าเช็ดตัวกง่าจะได้และวันคือจะข้ามวันอยู่แล้วค่ะ ราคากับบริการ อาหารถือว่าไม่สมดุลเลยค่ะ ห้อง799,1,facebook,9/22/2018
R0678,ห้องพักกว้าง เตียงนุ่ม นอนสบาย ห้องน้ำก้อกว้าง มีที่เสียบสายชาร์จที่หัวเตียง นอนเล่นมือถือ สบายเลย แอร์ดี มีมัดจำกุญแจ 300 บาท ตรงแผนกต้อนรับ มีขนมขบเคี้ยวขาย พวก มาม่า น้ำดื่ม มี ฟรี อาหารเช้า กาแฟ ไส้กรอก ขนมปัง สระว่ายน้ำ ตู้อบซาวน่า ใกล้ ฟิวเจอร์รังสิต คุ้มค่า มากๆ,1,facebook,7/22/2021
R0679,ห้องสะอาดดีนะคะ ห้องน้ำก็สะอาด แอร์เย็น มีไดร์เป่าผม มีที่จอดรถกว้างดี พนักงานบริการดีปกติค่ะ ราคาดีงาม เกือบจะดีทุกอย่างแล้ว แต่ ผ้าห่มมีคราบเลือดติด และไม่มีผ้าเช็ดเท้า และเซ็นเซอร์ดักจับควันกระพริบทั้งคืน นอนไม่ค่อยหลับเลย,1,facebook,9/5/2022
R0680,พักที่ใหนไม่เคยรู้สึกเเย่เเบบนี้ ผ้าเช็ดตัวเเม่บ้านบอกไม่เเห้ง บ่ายสองบ่ายสาม ผ้าไม่พร้อมบริการ โรงเเรมใหญ่โตขนาดนี้ ทำไมปล่อยให้ผ้าไม่พอใช้ บอกว่าให้ใช้ผ้าเก่าไปก่อน ตอนเเรกคิดว่า เดี๋ยวผ้าเเห้งคงมาเคาะประตูเอาผ้าให้ หายไปทั้งวันยันเลิกงาน,1,facebook,9/17/2022
R0681,ห้องที่ให้ก็อยู่ในหลืบ เหมือนห้องสำรอง ตรงป้ายทางหนีไฟ ที่ไม่มีบันไดหนีไฟ แต่เป็นสองห้องที่ทาสีเทา ห้องจะเล็ก กว่าห้องปกติ แคบๆ เหมือนห้องต่อเติม ออกมา ดัดแปลงจากทางหนีไฟ พนักงานก็บริการไม่ดี เหมือน บริการ ส่งๆไปงั้นๆ แบบ ขอไปที,1,facebook,10/12/2024
R0682,เคยเข้าพักช่วงเดือนสิงหาคม เรื่องการบริการและมารยาทน้ำเสียงในการพูดกับลูกค้าสำคัญค่ะ โรงแรมจะเติบโตได้ต้องมาจากการบริการที่ดีพูดเพราะ เป็นมิตร อยากให้มีพนักงานช่วยบริการเรื่องยกกระเป๋าค่ะเพราะบางทีเยอะค่ะ,1,facebook,11/6/2022
R0683,วันที่สองเว็บ แจ้งว่าเต็มแต่พอโทรถามมีห้องว่างต้องจ่ายราคา เท่านั้น600฿ซึ่งแพงกว่าและคุณภาพด้อยกว่าด้วย ห้อง 101,1,facebook,8/31/2024
R0684,ปกติเลือกพักที่นี่ตลอดเวลามาทำธุระแถวกทม,1,facebook,4/24/2021
R0685,พบกัยตัวเองเลย พนักงานผู้หญิงไม่ได้เรื่องเลยครับ มารยาทแย่มากๆ บอกให้ออกใบเสร็จพร้อม สุดท้ายออกให้แต่ แล้วยังบอกว่าถ้าจะเอาใบเสร็จต้องรออีก 1 วัน ค่อยมาเอาพรุ่งนี้ ตลกมากๆ จะขอพบผู้จัดการ นางบอกว่านางนี่แหละเป็นผู้จัดการ,1,facebook,11/21/2023
R0686,"ห้องแย่มาก โคตรสกปรกมากก มีทั้งแมลงสาบ ใยแมงมุม ไฮไลน์คือมีขวดโซดาผสมเหล้าที่กินแล้วแช่อยู่ในตู้เย็น ผ้าเช็ดตัวโคตรสกปรก เลอะเทอะมากผ้าปูที่นอนขาด ราคาที่จองคือ 1,600 บาท ห้อง ราคาก็ไม่ใช่ถูก ไม่มีอาหารเช้า ห้องพัก1",1,facebook,3/3/2020
R0687,รู้สึกแย่มากเลยค่ะ กับการพักโรงแรมนี้ พนักงานพูดจาได้แย่มาก เจ้าของควรอบรมเด็กของคุณบ้างนะคะ รู้สึกไม่ดีมากเลย ที่พักที่นี้,1,facebook,10/9/2019
R0688,จากนั้นโทรไปถามพนักงานบอกแอดไลน์ พอแอดไปไม่มีคนตอบ โทรตามเสร็จมาตอบคำถามนึง แล้วก็หายหัวไปเลย ห่วยแตกตั้งแต่ยังไม่เข้าไปพัก,1,facebook,7/29/2023
R0689,โดยรวม ทำเลที่ตั้งดีราคาถูกความสะอาดดีมีที่จอดรถ ไปพักมา3ครั้งแล้วค่ะ แต่ครั้งล่าสุดก่อนเช็คเอ้าท์เห็นผ้าม่านมีคราบแดงๆกระเด็นติดอยู่เลยไม่ได้แจ้งแม่บ้าน ตรงชั้น2ห้องริมสุดฝั่งซ้ายค่ะ ถ้าเป็นไปได้เปลี่ยนผ้าขนหนูหน่อยก็จะดีเลยค่ะ สีคล้ำทั้ง3ครั้งที่ไปพักเลยค่ะ,1,facebook,10/22/2020
R0690,ห้องพักตอนเย็นแสงเข้าสวยมาก ม่านมีสองชั้น มีม่านทึบบแสง ห้องพักสะอาด เตียงเป็นการเอาเตียงเดี่ยวมาต่อกัน มีระเบียงรับลม โลเคชั้นค่อนข้างลึกอยู่กลลางๆซอยๆ รอบๆไม่มีร้านสะดวกซื้อ,1,facebook,7/11/2024
R0691,พันเดียว นอนสบาย ได้เตียง 2 ชั้น เด็กๆชอบ มีสระว่ายน้ำให้เล่น มีอาหารเช้าให้ทานฟรีอีก นิดๆหน่อยพอได้รองท้อง ดีสุดๆ พนักงาน บริการดี,1,facebook,9/14/2024
R0692,ห้องสะอาด มีกาแฟทานได้ตลอด เช้ามีขนมปังไส้กรอกฟรี,1,facebook,4/2/2023
R0693,ห้องพักสะอาด โรงแรมอยู่ในซอย มีบริการให้เช่ามอเตอร์ไซค์ มีบริการส่งจากโรงแรมมาปากซอยฟรี จากปากซอยสามารถเดินมาขึ้นรถประจำทางได้ หน้าปากซอยมีแท๊กซี่ผ่าน ห้องพัก4,1,facebook,9/24/2024
R0694,กำลังจะเข้าพักวันที่21ตุลาที่จะถึงนี้ เห็นรีวิวทั้งดีและร้ายแต่จองผ่าน ไปแล้วมารอดูว่าจะหัวหรือก้อย แต่ดูจากรูปแล้วห้องสวยน่าอยู่มากครับ จัดไป3คืน เรื่องบริการไม่ซีขอสะอาดเป็นพอคราบบบบ,1,facebook,2/27/2024
R0695,ห้องพักดีมาก กว้าง สะอาด ราคาไม่แพงมาก ดีเยี่ยมมากๆๆ มีบริการรถไปส่งหน้าปากซอยและอื่นๆอีกมากมาย โดยรวมคือดี คราวหน้าจะกลับไปใช้บริการอีกค่ะ,1,facebook,9/2/2024
R0696,เจ้าจองโรงแรมเข้ามาเม้นก็ตอบแบบส่งๆ ไม่ได้ปรับปรุงอะไรตามที่พิมพ์ไว้หรอก ฟร้อนโง่ๆๆมาก ขี้เกียจด้วย ให้ทุกคนรอบ่าย2เพื่อเช็คอิน ไม่จัดระเบียบการทำงานเลย,1,facebook,11/5/2018
R0697,โรงแรมอยู่ในซอยลึกนิดหนึ่งค่ะ แนะนำเปลี่ยนพรมเช็ดเท้าเป็นแบบผ้าจะดีกว่าแบบที่ใช้อยู่ เพราะมันลื่นค่ะ โดยรวมก็ดีค่ะ,1,facebook,3/14/2020
R0698,แต่ขอติตอนเช้าที่แม่บ้านมาทำความสะอาดนะคะ พูดเสียงดังมากกกกกกกกก นอนอยู่ตอน 10 โมงต้องตื่นแล้ว พูดดังมาก เข้าที่พักตอนตี 1 ต้องตื่นมาฟังเขาคุยกันอีก,1,facebook,10/19/2022
R0699,บริการแย่มาก โทรมาปลุกตอนตี1กว่า นอนไม่หลับอีกเลย ไม่มีเซอร์วิสใดๆทั้งสิ้น ราคาห้องแพงเกินะจริง ห้องก็ไม่ค่อยดีฝักบัวพัง ขายของแพงมากกก ถามอะไรพนักงานก็ไม่ค่อยอยากตอบ,1,facebook,5/12/2019
R0700,พักที่นี้บ่อยมากค่ะ รอบหลังนี้พนักงานผู้หญิงที่รับโทรศัพท์กับที่อยู่หน้าเคาน์เตอร์ พูดจาแย่มากค่ะ เสียดายนะคะ ห้องโอเครเลยแต่คงไม่มาอีกแล้วค่ะ พนักงานทำเหมือนมาขออยู่ฟรีๆ เสียความรู้สึกค่ะ,1,facebook,9/21/2022
R0701,พนักงานบริการดี ยิ้มแย้ม แจ่มใส สถานที่ สะอาดดี การเดินทางสะดวก แต่เข้าซอยลึกไปนิด ค่ะ,1,facebook,2/16/2019
R0702,เราเสียตังค์เข้าพักไม่ได้มาขออยุ่ฟรีๆถ้าไม่พอใจให้พักก็ไม่ต้องให้เช็คอินเข้าซิอะไรที่เป็นกฏทาง รร เราไม่ทราบควรบอกแจ้งเราดีๆไหม,1,facebook,10/24/2024
R0703,ไม่สะอาด ไม่เปลี่ยนปลอกหมอนและผ้าห่มมีรอยยับจากการใช้งานอย่างเห็นได้ชัดเจน เช็คอินและเช็คเอาท์ใน10 นาทีต่อมา,1,facebook,2/3/2023
R0704,ห้องพักสะอาดใช้ได้ นอนสบายราคาโอเค แต่แอบหายากหน่อยเพราะที่พักอยู่ในซอย ใกล้ๆมีวินมอไซค์เรียกได้,1,facebook,12/21/2024
R0705,ดีมากคับ บริการดี บรรยากาศดี,1,facebook,1/7/2020
R0706,โดยรวมดีค่ะ เข้าพักวันแรกห้องพักดูสะอาดตาดีค่ะ พักวันที่2แม่บ้านทำความสะอาดไม่ค่อยสะอาดเลยค่ะ พื้นห้องน้ำค่อนข้างลื่นค่ะ,1,facebook,7/22/2021
R0707,ห้องสะอาด น้ำไหลแรง เข้าซอยไม่ลึกมาก ที่จอดรถสะดวก ถือว่าผ่านค่ะ,1,facebook,11/28/2019
R0708,ห้องพักราคาย่อมเยา เพียงแต่อยู่ในซอยลึกพอสมควร มีวิวดูเครื่องบินลง,0,facebook,5/1/2021
R0709,พอปรับราคาปกติ ค่อนข้างราคาสูงไป สำหรับทำเลซอยนี้ ห้องหักสวยครับ ใหม่มาก,1,facebook,3/9/2021
R0710,แนะนำเลยค่ะ สะอาด น่าพัก ราคาถูก คุ้มค่า แต่ส่วนใหญ่จะเต็ม,1,facebook,2/20/2024
R0711,สระว่ายน้ำน่าเล่น บริการประทับใจ เหมาะสำหรับมาพักที่โรงแรมนี้ค่ะ,1,facebook,3/21/2018
R0712,อาหารเช้าไม่มีการจัดเตรียมไว้เพียงพอ ต้องรอเป็นเวลานานและ หากเติมหมดแล้วคือหมดเลย,1,facebook,1/12/2023
R0713,โรงแรมเข้าซอยลึกไปหน่อย แต่มีวินมอเตอร์ไซค์ให้บริการหน้าปากซอยค่ะ,1,facebook,5/9/2020
R0714,ที่พักสบาย มีที่จอดรถบริการให้ อาหารที่ โรงแรมค่อนข้างแพง มีเสียงรถรบกวนตอนกลางคืน,1,facebook,11/18/2023
R0715,ห้องพักแย่มากก ห้องน้ำไม่มีสะอาดเลย ห้องก็ไม่มีความสะอาดเลย,1,facebook,6/2/2024
R0716,พนักงานพูดจาไม่ดีเรย ใครจะมาพัก หาที่อื่นดีกว่า พนง ต้อนรับห่วยแตก,1,facebook,10/27/2023
R0717,ที่พักสะอาด ใกล้แหล่งช๊อปปิ๊งใกล้แหล่ง ร้านอาหารมากมาย การเดินทางสะดวกสบาย,0,facebook,10/10/2023
R0718,บริการเป็นกันเอง,1,facebook,7/23/2025
R0719,โดยรวมแล้วก็สะอาด มันมีห้องขนาดใหญ่ มีบาร์ ร้านอาหาร และร้านขายของชำขนาดเล็ก,1,facebook,10/15/2020
R0720,จองล่วงหน้าจะถูกกว่า 40 ห้องพักดี ทุกอย่างทำงานได้ดี,1,facebook,10/27/2021
R0721,ศูนย์ออกกำลังกายเป็นเรื่องตลกเล็กน้อย กาแฟก็โอเคนะ 40 บาท คุณสามารถทานอาหารดีๆ ได้ที่ร้านอาหารท้องถิ่นซึ่งอยู่ห่างจากโรงแรมประมาณ 50 เมตร ในราคาประมาณ 6070,1,facebook,2/23/2024
R0722,ไม่แนะนำโรงแรมนี้ มันอยู่ไกลจากถนนสายหลัก,1,facebook,12/5/2020
R0723,ราคาดี ห้องพักสะอาด มี ดี ฉันพักที่นี่แค่คืนเดียว แต่ฉันจะจองที่นี่แน่นอนหากฉันจะไปกรุงเทพอีกครั้ง,1,facebook,9/27/2023
R0724,ห้องพักเดินทางสะดวกสะบายสำหรับคนมีรถส่วนตัว ภายในห้องอ่างล้างหน้าน้ำระบายช้า มีมดดำขึ้นตามอ่างล้าวหน้า แอร์ไม่เย็น ร้อนมากเหมือนอบซาวน่า,1,facebook,11/20/2019
R0725,เข้าพัก17 มคเข้าไม่ถึง2 นาทีเมื่อเข้าห้องเปิดห้องที่นอนไม่มีการเปลี่ยนผ้าปูยับเยินลอง เปิดผ้าห่มสิ่งที่เจอคือ,1,facebook,8/22/2025
R0726,โดยรวมโอเคค่ะ,1,facebook,2/19/2021
R0727,ห้องพักถือว่าดีเป็นห้องปูนเปลือย ห้องกว้างตามมาตรฐาน ความสะอาดถือว่าใช้ได้ แต่ห้องน้ำไม่มีผ้ากั้นสำหรับอาบน้ำ เวลาอาบน้ำน้ำก็จะกระเด็นไปทั่วห้องน้ำ ห้อง บี 27 และ บี28 ที่เรานอน แอร์ไม่เย็น,1,facebook,10/27/2020
R0728,ที่พักอยู่ในซอย700เมตร แต่อยู่ในเมืองใกล้ฟิวเจอร์ รถสาธารณะเยอะ นั่งแทกซี่จากฟิวเจอร์มา 50 บาท ที่พักไม่แพง พักแบบ2ห้องนอน2ห้องน้ำ 1299บาทคืน ราคาดี แม่บ้านลืมผ้าเช็ดตัวแต่โทรแจ้งก็รีบเอามาให้ ทีวีจอแบนแต่สัญญาณไม่ดีดูชัดเป็บางช่อง อุปกรณ์ในห้องน้ำครบ มีไดร์ มีกาน้ำร้อน มีอาหารเช้าง่ายๆ กาแฟ ขนมปัง ฮอทดอกไก่,1,facebook,10/22/2022
R0729,แอร์เย็นฉ่ำ มีไดร์ให้ เครื่องทำน้ำอุ่นทำงานดี น้ำแรง ถือว่าโอเคค่ะ,1,facebook,6/24/2023
R0730,มีอาหารเช้าแบบบุฟเฟต์ แต่เป็นไส้กรอก ขนมปังปิ้ง และกาแฟ ส่วนตัวไม่กินกาแฟเท่าไหร่ เลยรู้สึกว่าของน้อย แต่ราคาห้องโอเค ห้องนอนสะอาด พนักงานทำความสะอาดดีเว่ออ,1,facebook,10/22/2020
R0731,มาใช้บริการ 2 ครั้งไม่เคยได้รับการบริการที่ดีเลยฟสักครั้ง พนักงาน แต่ละคนเหมือนถูกบังคับให้มาทำงาน มาตรฐานรร,1,facebook,6/12/2022
R0732,ห้องพักเหมือนแอร์เย็นไม่ทั่วถึงสักหน่อย อย่าอื่นโอเคเลย อยู่ใกล้แหล่งของกิน ห้าง เดินทางสะดวก,1,facebook,6/5/2023
R0733,ซอยแคบมาก ไฟมืดสลัวๆ ห้องค่อนข้างอึดอัด,1,facebook,10/19/2022
R0734,ห้องพักราคากลางๆพักบ่อยครับ อยู่ในซอยลึกไปหน่อยแต่ไม่น่ากลัวห้องดี สะอาดโอเค แต่รอบล่าสุดไปผ้าเช็ดตัวเหม็นกลิ่นไม่แห้งครับ สองผืนเลยเซงนิดๆ,1,facebook,11/5/2020
R0735,บริการดี ห้องพักราคาประหยัด สะอาด ปลอดภัย มีที่จอดรถ ที่สำคัญใกล้สนามบินดอนเมืองมาก,1,facebook,4/22/2022
R0736,จองห้องถึงกันพักสี่คน ห้องสะอาด แอร์เย็นดี มีอุปกรณ์ครบ แม่บ้านลืมผ้าเช็ดตัว พอแจ้งก็็รีบนำมาให้น้องพนักงาน น่ารักขอฝากรถไว้หลังเช็คเอาท์เพราะไปเที่ยวอีเกียให้ความช่วยเหลือดั อาหารเช้าง่ายๆกาแฟ ขนมปัง ฮอทดอกไก่กาแฟมีฟรีตลอด24ชม,1,facebook,6/26/2025
R0737,นํ้าไหลช้า มาก อาบนํ้าไม่ได้เลย แก้ไขแบบไม่มีความรู้ทำส่งๆใช้งานไม่ได้ พัก3คืน เจอแบบนี้ เหมือนตกนรกเลย,1,facebook,9/17/2020
R0738,เฟอร์นิเจอร์ค่อนข้างเก่า เครื่องทำน้ำอุ่นใช้งานไม่ได้ แอร์เก่า รู้สึกไม่สะอาด คอมเพรสเซอร์ มีนกพิราบมาทำรัง นอนแล้วป่วย ไม่สบาย การออกแบบห้อง ตำแหน่ง ปลั๊ก สวิทต์ไฟ แปลกๆ ผนังห้องบาง ได้ยินเสียงห้องข้างๆ ห้องไม่ได้กว้างมาก,1,facebook,7/25/2021
