review_id,text,label,platform,date
R1444,สถานที่เหมาะกับเด็กๆมาก สนามเด็กเล่น กว้างขวางเป็นแบบเชือกผสมไม้ กระดานลื่น ชิงช้า บ่อทราย ร่มไม้ ริมน้ำ,1,youtube,7/31/2022
R1445,ทางเราขออธิบายเพิ่มเติมถึงเหตุผลในการให้น้องๆ เข้าไปนั่งเรียน โดยให้ผู้ปกครองรอน้องๆ อยู่ด้านนอก,1,youtube,11/10/2024
R1446,เนื่องจากเราต้องการให้น้องๆ ได้มีสมาธิในการทำผลงาน ส่งเสริมให้เกิดจินตนาการของเค้าเองโดยไม่มีกรอบมาจำกัด และให้น้องได้ทำผลงานด้วยมือของเค้าเอง,1,youtube,10/20/2022
R1447,สื่งที่สำคัญที่สุดคือ เราอยากให้ผู้ปกครองได้ตั้งคำถามและชวนน้องพูดคุยถึงกระบวนความคิดและเหตุผลในการทำผลงานชิ้นนั้นๆ ของเขา เพื่อเป็นการต่อยอดจินตนาการให้แก่เด็กๆ,1,youtube,7/21/2021
R1448,ส่วนการติดแอร์และเป็นห้องปิดก็เพื่อให้ผู้เรียนรู้สึกผ่อนคลายและมีสมาธิ ในภาวะอากาศที่ไม่แน่นอนของบ้านเรา และปราศจากเสียงรบกวนจากภายนอก และเมื่อน้องๆ ได้ออกมาจากห้องพร้อมผลงานที่เค้าภูมิใจ ก็จะได้มาสัมผัสกับธรรมชาติรายล้อมในพื้นที่ของเรารวมถึงวิถีชีวิตริมแม่น้ำ ซึ่งไม่สามารถสัมผัสได้ในห้างสรรพสินค้าอย่างแน่นอน,1,youtube,11/22/2021
R1449,ส่วนเกมส์เราก็มีหลายเกมส์ทั้งง่าย เช่นสอยดาวที่มีทุกรางวัล และยากขึ้นมาตามแต่อายุของเด็ก รวมถึงผู้ใหญ่ก็ร่วมสนุกได้ด้วยความสมัครใจ ซึ่งมูลค่าของรางวัลหลายอย่างก็สูงกว่าราคาตั๋วเกมส์ 30 บาทหลายเท่าตัว และเราก็ไม่ได้เก็บค่าเข้ามาเที่ยวงานหรือสถานที่ของเราแต่อย่างใด,1,youtube,2/20/2024
R1450,สุดท้ายนี้ เราอยากเรียนว่า ทางเรามุ่งหวังที่จะสร้างพื้นที่นี้สำหรับครอบครัวได้มาทำกิจกรรมร่วมกัน หลีกหนีจากความวุ่นวายของสังคมเมือง เด็กๆ ไม่จับมือถือและไอแพด ได้มาวิ่งเล่นได้เหงื่อท่ามกลางธรรมชาติ พร้อมทั้งได้เรียนรู้กระบวนการคิดและการสร้างสรรค์ผลงานตามช่วงอายุต่างๆ ของเด็กค่ะ,1,youtube,11/11/2023
R1451,ตอบโจทย์คนมีลูกมากครับ,1,youtube,9/14/2021
R1452,อาหารอร่อย มาไว พนักงานบริการดี,1,youtube,4/17/2021
R1453,แวะเข้าไปจิบกาแฟตากแอร์หนีร้อนริมแม่น้ำเจ้าพระยา ที่นี่มีโซนโรงแรม สนามเด็กเล่น ร้านอาหารและร้านกาแฟ มีของขายนิดหน่อย เหมาะกับมาเที่ยวทั้งครอบครัว พาเด็กมาเล่นเครื่องเล่น ส่วนกาแฟโอเคราคาสมเหตุสมผล,1,youtube,4/5/2024
R1454,ร้านโรแมนติคบรรยากาศดี มีจุดชมวิว ร่มรื่นกว้างขวาง เดินเข้าด้านในสุดร้านจะติดริมแม่น้ำ เหมาะสำหรับคู่รัก ครอบครัว,1,youtube,6/5/2019
R1455,อาหารค่อนข้างแพง รสชาติใช้ได้ไม่ถึงกับดีมาก บรรยากาศดีค่ะ มีสนามเด็กเล่น เหมาะกับพาเด็กๆไป เที่ยว ส่วนเค้กก็โอเคค่ะ ไม่ถึงกับประทับใจ โดยรวมคือขายบรรยากาศ บรรยากาศดีมีอะไรให้เด็กเล่นหลายอย่าง,1,youtube,1/24/2019
R1456,ร้านสวย บรรยากาศดี มีกิจกรรมให้เด็กๆได้เล่นมากมาย แต่ราคาค่าอาหารก็จะสูงหน่อย และเมนูอาหารไทยมีไม่มาก พนักงานน่ารัก บริการดี ดูแลเรื่องความสะอาดดี ฉีดฆ่าเชื้อที่สนามเด็กเล่นด้วยทุกๆชั่วโมง,1,youtube,2/27/2024
R1457,สถานที่กว้างขวาง บรรยากาศดีมาก ต้นไม้เยอะ ร่มรื่น ไม่ค่อยร้อน มุมถ่ายรูปมากมาย สนามเด็กเล่นใหญ่ มีกิจกรรมให้เด็กๆทำเพียบ ติดแม่น้ำเจ้าพระยา,1,youtube,2/17/2025
R1458,กาแฟอร่อย ขนมอร่อย มีหลายโซนให้เลือกเดินชม เหมาะสำหรับครอบครัวที่มาพร้อมเด็กๆ,1,youtube,11/8/2023
R1459,นายชอบมาก,1,youtube,1/4/2023
R1460,บรรยากาศดี เหมาะสำหรับเด็ก สบายๆ มีอาหาร และเครื่องดื่ม ราคาสูงแค่เทียบกับบรรยากาศแล้ว คุ้มค่าค่ะ,1,youtube,10/23/2020
R1461,เป็นสถานที่ดีมากๆ ที่พัก ห้องสวยสะอาด เป็นส่วนตัว ร่มรื่น,1,youtube,5/15/2022
R1462,ทำเลปทุมธานี ริมน้ำ เข้าออกสะดวกหาไม่ยาก,1,youtube,4/19/2019
R1463,สถานที่ดีน่านั่งเหมาะสำหรับผู้ใหญ่และเด็ก มีสถานที่เด็กเล่น อากาศร้อนไปหน่อยถ้าไปตอนกลางวัน เหมาะสำหรับพาเด็กไปทานข้าวและเล่นเครื่องเล่น ถ้ามาหลังจาก 6 โมงเย็นไปแล้วจะไม่ร้อน สถานที่จอดรถกว้างขวาง แต่ราคาแพงไปหน่อย,1,youtube,9/27/2021
R1464,คาเฟ่ แอร์เย็นฉ่ำ น้ำรสชาติดี บรรยากาศดีมาก กิจกรรม ทำผ้ามัดย้อมก็ดี ที่เล่นเด็กกว้าง และพื้นที่ในร้านใหญ่ ไม่แออัด,1,youtube,7/10/2020
R1465,มีทั้งร้านอาหาร กาแฟ ขนม ราคาค่อนข้างสูง อาหารรสชาติดีใช้ได้ เครื่องดื่มรสชาติพอใช้ บรรยากาศดี มีวิวสวน ริมน้ำเจ้าพระยา และยังเหมาะพาเด็กๆมาเล่นเพราะมีสนามเด็กเล่นด้วย,1,youtube,5/31/2020
R1466,ชอบบรรยากาศที่นี่มากเลยค่ะร่มรื่นแม้จะอากาศร้อนแต่ลมเย็นสบาย อาหารก็อร่อย วันที่ไปสั่ง,0,youtube,7/24/2020
R1467,มอคค่ามาทาน อร่อยๆ พาลูกไปปล่อยพลังดีม๊ากก,1,youtube,11/6/2020
R1468,บรรยากาศดีเหมาะกับการมาเป็นครอบครัว มีเครื่องเล่นใต้ร่มไม้ใหญ่และมีกิจกรรมให้เด็ก ๆ หลายกิจกรรม มีร้านอาหาร ร้านกาแฟ โดยเฉพาะร้านกาแฟด้านหลังอยู่ติดริมแม่น้ำสามารถนั่งชมวิวได้เลย ที่จอดรถที่ร้านกว้างขวาง,1,youtube,10/5/2021
R1469,คาเฟ่ ร้านอาหาร ที่พัก ทำกิจกรรม สนามเด็กเล่น ติดริมน้ำเจ้าพระยา บรรยากาศดีร่มรื่น มีที่จอดรถเยอะ แต่ราคาอาหารสูง พอสมควร ครับ,0,youtube,11/6/2021
R1470,ร้านอาหารน่ารัก ริมน้ำ มีกิจกรรมให้เด็กๆและครอบครัวได้ทำร่วมกัน มีมุมถ่ายรูปสวยๆเยอะ อาหาร ขนม เครื่องดื่มรสชาติดี เหมาะกับการพักผ่อนในช่วงวันหยุด ที่จอดรถกว้างขวาง แนะนำครับร้านนี้,1,youtube,7/12/2024
R1471,อาหารอร่อย ทุกอย่าง แนะนำ,1,youtube,10/9/2023
R1472,ลาบเห็ด ตำถาด ขนมจีนน้ำยา เด็ดมากค่ะ ต้องลองน้าาา,0,youtube,1/28/2020
R1473,ร้านที่มีมุนสวยๆให้ถ่ายรูปเยอะมากกกค่ะ มีมุนของสนามเล่นเด็กได้เล่นสนุกสนาน วิวร้านติดแม่น้ำสวยค่ะ สถานที่นั่งมีหลายมุนให้เลือกนั่งทั้งโซนอาหาร โซนเครื่องดื่ม มีหลากหลายมากค่ะ เป็นอีกร้านที่อยากไปอีกหลายๆครั้งค่ะ,1,youtube,9/5/2024
R1474,อาหารอร่อย กาแฟเยี่ยม บรรยากาศดีริมแม่น้ำ มีสถานที่ให้เด็กๆทำกิจกรรม ระบายสี ปั้นดิน ที่เล่นกลางแจ้ง ที่จอดรถเยอะ,1,youtube,4/18/2019
R1475,เหมาะกับเด็กๆ มาก พื้นที่กว้าง ที่เล่นเยอะ มีทั้งห้องแอร์และรับลมธรรมชาติ เค้กไม่อร่อย อาหารแพงกว่าทั่วไปแต่รับได้ เพราะสถานที่ดี แนะนำให้มาครับ,1,youtube,7/19/2024
R1476,บรรยากาศโอเคเลย มีร้านอาหาร คาเฟ่ สวนให้เดินเล่น แต่อาหารค่อนคข้างแพงกับปริมาณที่ได้รสชาติบางเมนูยังต้องปรับปรุง มีสวนให้เด็กวิ่งเล่นได้,1,youtube,1/28/2019
R1477,สถานที่ดี มีกิจกรรมให้เด็กหลากหลาย ห้องน้ำสะอาด มีห้องน้ำสำหรับเด็กโดยเฉพาะ สิ่งอำนวยความสะดวกครบ อาหารอร่อย เหมาะเป็นที่พักผ่อนสบายๆและหากิจกรรมทำร่วมกันในครอบครัว,1,youtube,5/23/2024
R1478,สะอาดดีค่ะ เครื่องเล่นเยอะและสถานที่กว้างขวางมาก มีกิจกรรมให้เล่นเยอะค่ะมีบรรยากาศให้พักผ่อนหลากหลายดีค่ะ พอดีไปช่วงวันหยุดยาวคนค่อยข้างเยอะมาก จึงไม่ค่อยได้รับการบริการที่ดีเท่าไหร่ค่ะ,1,youtube,8/24/2021
R1479,อยู่ติดแม่น้ำเจ้าพระยาสวย,1,youtube,7/1/2020
R1480,บรรยากาศดี มีที่ให้ถ่ายรูปเยอะ มีโรงแรมด้วย มีทั้งอาหาร กาแฟเครื่องดื่ม ของหวาน มีกิจกรรมสำหรับเด็กๆ ราคาแรงอยู่แต่ก็คุ้มกับคุณภาพ รสชาติโกโก้ปั่น ไม่หวานมาก เข้มข้น ถึงรสโกโก้ พิซซ่าอร่อยมาก สลัดกับปลาก็คุ้มราคา รวมๆยะไปซ้ำค่ะ แต่วันหยุดคนเยอะมากๆๆๆ ที่จอดรถดูน้อยไปเลย,1,youtube,11/29/2019
R1481,บรรยากาศดี สไตล์ครอบครัว ราคาสูงอยู่ อาหาร เครื่องดื่ม ขนม อร่อย,1,youtube,3/14/2021
R1482,ร้านน่ารัก เด็กๆ ชอบมาก ร้านกว้างมาก มีกิจกรรมให้ทำเยอะมากค่ะ,1,youtube,4/7/2022
R1483,บรรยากาศดีมาก,1,youtube,2/20/2024
R1484,กว้างขวาง สวย ธรรมชาติ เหมาะกับครอบครัว,1,youtube,11/26/2018
R1485,อาหารแอบแพงนิด แต่ก๋เข้าใจได้ ในส่วนต่างที่ต้องใช้เงินจำนวนมากในการ บำรุงดูแลสถานที่,1,youtube,10/26/2020
R1486,ดีมากคะ มีทั้งร้านอาหาร คาเฟ่ เพลย์กราวด์ รวมอยู่ที่เดียวกัน มีที่พักด้วยนะคะ หากใครสนใจมาพัก,1,youtube,10/12/2020
R1487,ที่วิ่งเล่นเด็กสะอาดและกว้างขวางดี หลากหลายครับ สถานที่โอเคมาก บรรยากาศดีจัดร้านสวยมากกก,1,youtube,7/4/2020
R1488,สถานที่ปักหมุดแห่งใหม่ สะอาด เดินทางมาไม่ยาก บรรยากาศดี มีต้นไม่ร่มรื่น กาแฟรสชาดดี ราคาสูงเล็กน้อย มีที่ให้เด็กๆทำกิจกรรมมัดย้อม ศิลปะ เล่นทราย ใกล้ชิดธรรมชาติ แต่ระวังมดตะนอยกับแมลงสักนิด,1,youtube,6/11/2022
R1489,อาหารเครื่องดื่ม ขนมเค๊ก อร่อย มีพื้นที่ให้เด็กเล่นมากมาย แต่ทางในร้านเป็นทางโรยหิน ไม่เหมาะสำหรับรถเข็นเลย,1,youtube,6/22/2025
R1490,สถานที่กว้าง มีสนามวิ่งเล่น.,1,youtube,7/19/2021
R1491,บรรยากาศดี ที่พัก พอใช้ได้ แต่กิจกรรมสำหรับเด็กค่อนข้างน้อย มีกิจกรรมย่อย แยกเป็นรอบๆ แบบมีค่าใช้จ่าบ,1,youtube,2/7/2023
R1492,ร้านติดริมแม่น้ำเจ้าพระยา,1,youtube,10/12/2024
R1493,มีโซนร้านอาหาร โซนร้านกาแฟ เบเกอรี่,1,youtube,12/21/2024
R1494,มีที่ให้เด็กเล่น มีกิจกรรมสำหรับเด็ก เหมาะสำหรับครัวครัวที่มีเด็กเล็กค่ะ,1,youtube,12/27/2025
R1495,ลูกสาวอยากมาเล่นที่นี่กับเพื่อน ก็เลยพามา บรรยากาศดี ใครที่มีลูกหลานน่าจะชอบ แต่ถ้าตั้งใจมาทานอาหารอย่างเดียวน่าจะแพงเกินไปหน่อยนะครับ,1,youtube,6/26/2023
R1496,มีลูกพาลูก มีหลานพาหลานค่ะ ที่เรียนศิลปะเก๋ๆ มีหลายคอร์ส มีร้านอาหาร ร้านกาแฟริมน้ำ บอกเลยว่ามันดีมากจริงๆ ต้องมาค่ะ ใกล้ๆกรุงเทพแค่นี้เอง,1,youtube,7/27/2018
R1497,เป็นที่ให้เด็กทำกิจกรรม ย้อมผ้า เพ้นสีเสื้อ และอื่น มีร้านกาแฟ ร้านอาหาร ในตัวเผื่อพ่อๆแท่ๆผู้ปกครองรอลูกทำกิจกรรมได้ ติดริมแม่น้ำเจ้าพระยา,1,youtube,10/24/2020
R1498,ร้านกาแฟบรรยากาศดี เหมาะกับเด็กเล่น มีกิจกรรมศิลปะ สถานที่กว้างขวางที่จอดรถเยอะ,1,youtube,1/29/2021
R1499,ราคาทั่วไป มีโปรโมชั่น มีสนามเด็กเล่น เหมาะกับพาเด็กๆ มาเที่ยว เป็นครอบครัว,1,youtube,11/22/2025
R1500,ต้นไม้เยอะดี แม้จะสู้อากาศที่ร้อนมากไม่ได้ แต่ก็ยังมีร่มให้เด็กได้วิ่งเล่น กิจกรรมต่างๆก็เยอะดี มีอาหารและกาแฟให้ทานด้วย,1,youtube,2/13/2022
R1501,ราคาแพงตามปกติของคาเฟ่,1,youtube,11/13/2023
R1502,มีบริเวณที่จอดรถ,1,youtube,5/1/2019
R1503,มีสนามเด็กเล่น,1,youtube,10/19/2018
R1504,บรรยากาศดี กว้าง บริการดี อาหารใช้ได้ แต่ครัวปิดหัวค่ำไปหน่อย ครัวปิด 19.30 ร้านปิด 20.00 เหมาะกับมาทานตอนบ่ายหรือเย็น,1,youtube,11/25/2023
R1505,เหมาะกับครอบครัว โดยเฉพาะ ที่มีเด็กๆ เป็นสถานที่ที่ตั้งใจทำออกมาได้ดี สนับสนุนให้มาใช้บริการกันเยอะๆครับ,1,youtube,12/2/2021
R1506,เป็นสถานที่ดี เหมาะสำหรับเด็ก มีกิจกรรมสำหรับเด็ก มีร้านอาหาร ร้านกาแฟ นั่งทาน อาหารรสชาดดี บรรยากาศดี,1,youtube,4/2/2023
R1507,ร้านติดแม่น้ำ บรรยากาศดี มีที่ให้เด็กวิ่งเล่น มีมุมถ่ายรูปสวยๆ กาแฟรสชาติดี,1,youtube,9/18/2021
R1508,บรรยากาศดีนั่งชิล มีกิจกรรมให้ทำ เหมาะสำหรับเด็กๆและทุกคนในครอบครัว,1,youtube,2/20/2024
R1509,ไปช่วงเย็นวันอาทิตย์ คนไม่เยอะมาก ไปทานข้าวและกินเค้ก ค่ะ อาหารรสชาติพอได้และเครื่องดืมโอเคเลยค่ะ แต่เค้กยังไม่ผ่านค่ะ,1,youtube,7/19/2021
R1510,สถานที่ดีมาก สวยงาม เป็นธรรมชาติ กว้างขวาง พนักงานบริการดีทุกคน อาหารอร่อย,1,youtube,2/24/2018
R1511,อาหารและเครื่องดื่มยำปลาทูอร่อยมากค่ะ,1,youtube,10/26/2020
R1512,ขนมอร่อย บรรยากาศดี มีงานศิลปะให้ชมและช็อปปิ้งด้วย,1,youtube,6/10/2023
R1513,บรรยากาศดีมาก อาหารดี ราคาแรง เหมาะกับครอบครัวพาเด็กๆมาวิ่งเล่น,1,youtube,8/8/2024
R1514,อาหารอร่อย บรรยากาศดี มีที่ให้เด็กเล็กได้ทำกิจกรรมด้วย,1,youtube,6/21/2020
R1515,สถานที่ดีมากๆค่ะ พนักงานดีเลิศ ที่พักดีงาม เหมาะกับเด็กและครอบครัว ไปซ้ำแน่นอนค่ะ,0,youtube,9/24/2022
R1516,พนักงานดูและดี ฉีดสนามเด็กเล่นทุกชั่วโมง อาหารอร่อย ถ้าเที่ยงอาจรอนานหน่อย,1,youtube,12/9/2018
R1517,วิวดีบรรยากาศน่าอยู่มีความโมเดรินแต่ของหรืออาหารเครื่องดื่มค่อนข้างจะแพง,1,youtube,9/12/2025
R1518,บรรยากาศดี ริมน้ำเจ้าพระยา อาหารดี มีกิจกรรมดีดีที่ไม่ต้องใช้อิเลคทรอนิคส์,1,youtube,5/31/2021
R1519,จัดการพื้นที่ได้เรียบร้อย เป็นระเบียบ สถานที่ติดริมน้ำที่น่าแวะเวียนมากครับ,1,youtube,9/18/2022
R1520,ดีจ้า...สนุก สวย วิว อิ่ม,1,youtube,3/3/2024
R1521,มีกิจกรรมให้ทำมากมาย มีคลาสศิลปะที่ต้องเสียเงิน แต่ดูน่าสนใจมากสำหรับครอบครัว,1,youtube,2/19/2024
R1522,สำหรับเด็กก็มีชิงช้า สไลเดอร์ และอื่นๆ,1,youtube,2/3/2019
R1523,รูปสวยๆเยอะเหลือเกิน,1,youtube,9/4/2024
R1524,ผักย่างอร่อย,1,youtube,1/1/2019
R1525,มีมุมถ่ายรูปมากมาย!!!,1,youtube,11/4/2024
