review_id,text,label,platform,date
R2283,กลับมาพักอีกแน่นอน มาเที่ยวกับเพื่อน แม่บ้านทำความสะอาดดีมาก วิวทะเลจากห้องพักสวยมาก,1,agoda,4/19/2023
R2284,ๆ อาหารเช้ามีให้เลือกเยอะ มีร้านสะดวกซื้อใกล้ มาพักช่วงวันหยุดยาว กลับมาพักอีกแน่นอน,1,agoda,4/19/2018
R2285,ห้องพักสะอาดมาก กลับมาพักอีกแน่นอน วิวทะเลจากห้องพักสวยมาก มาเที่ยวกับเพื่อน,1,agoda,2/12/2023
R2286,มาพักก่อนบินวันรุ่งขึ้น เดินทางสะดวก เตียงนอนสบาย เหมาะกับครอบครัว,1,agoda,4/16/2019
R2287,สามารถเดินไปห้างได้ พาครอบครัวมาพักผ่อน ห้องพักสะอาดมาก มีโอกาสจะกลับมาพักอีก,1,agoda,11/14/2021
R2288,พนักงานสุภาพและบริการดี มาพักก่อนบินวันรุ่งขึ้น มีทางเดินริมทะเล แนะนำสำหรับคนที่มาเที่ยวพัทยา,1,agoda,1/15/2020
R2289,บรรยากาศเงียบสงบ แนะนำสำหรับคนที่มาเที่ยวพัทยา แม่บ้านทำความสะอาดดีมาก เข้าพักระหว่างเดินทางธุรกิจ,0,agoda,5/4/2021
R2290,อยู่ใจกลางเมือง เตียงนอนสบาย เข้าพักระหว่างเดินทางธุรกิจ แนะนำสำหรับคนที่มาเที่ยวพัทยา,1,agoda,10/21/2022
R2291,จะบอกต่อเพื่อน เข้าพักระหว่างเดินทางธุรกิจ ๆ วิวทะเลจากห้องพักสวยมาก แน่นอน แอร์เย็นไว,1,agoda,11/16/2024
R2292,แนะนำสำหรับคนที่มาเที่ยวพัทยา แอร์เย็นไว บรรยากาศเงียบสงบ พักเพื่อประชุม,1,agoda,9/23/2019
R2293,คุ้มค่ากับราคาที่จ่าย แวะพักระหว่างขับรถทางไกล ๆ ห้องพักสะอาดมาก มีร้านสะดวกซื้อใกล้,1,agoda,11/2/2020
R2294,ๆ มีร้านสะดวกซื้อใกล้ มาเที่ยวกับเพื่อน กลับมาพักอีกแน่นอน อาหารเช้ามีให้เลือกเยอะ,1,agoda,12/13/2021
R2295,จองห้องกระทันหัน เตียงนอนสบาย คุ้มค่ากับราคาที่จ่าย มีทางเดินริมทะเล,1,agoda,2/2/2022
R2296,อยู่ใจกลางเมือง มีโอกาสจะกลับมาพักอีก เตียงนอนสบาย มาเที่ยวกับเพื่อน,1,agoda,10/22/2020
R2297,เข้าพักระหว่างเดินทางธุรกิจ อยู่ใจกลางเมือง การเช็คอินรวดเร็ว เหมาะกับครอบครัว,1,agoda,11/3/2019
R2298,ประทับใจมากโดยรวม ห้องพักสะอาดมาก สามารถเดินไปห้างได้ มาเที่ยวกับเพื่อน,1,agoda,2/8/2024
R2299,แอร์เย็นไว พักเพื่อประชุม คุ้มค่ากับราคาที่จ่าย มีร้านสะดวกซื้อใกล้ ๆ,1,agoda,2/20/2024
R2300,บรรยากาศเงียบสงบ มาพักก่อนบินวันรุ่งขึ้น ประทับใจมากโดยรวม การเช็คอินรวดเร็ว,0,agoda,3/29/2024
R2301,มีร้านสะดวกซื้อใกล้ แม่บ้านทำความสะอาดดีมาก แวะพักระหว่างขับรถทางไกล ๆ มีโอกาสจะกลับมาพักอีก,1,agoda,6/17/2022
R2302,คุ้มค่ากับราคาที่จ่าย มาพักช่วงวันหยุดยาว อาหารเช้ามีให้เลือกเยอะ อยู่ใจกลางเมือง,1,agoda,9/8/2024
R2303,อยู่ใจกลางเมือง มาพักก่อนบินวันรุ่งขึ้น กลับมาพักอีกแน่นอน แม่บ้านทำความสะอาดดีมาก,0,agoda,2/5/2023
R2304,แวะพักระหว่างขับรถทางไกล ถือเป็นตัวเลือกที่ดี บรรยากาศเงียบสงบ เตียงนอนสบาย,1,agoda,3/20/2022
R2305,วิวทะเลจากห้องพักสวยมาก แนะนำสำหรับคนที่มาเที่ยวพัทยา แม่บ้านทำความสะอาดดีมาก เข้าพักระหว่างเดินทางธุรกิจ,1,agoda,8/29/2020
R2306,มีของใช้ครบในห้องพัก พาครอบครัวมาพักผ่อน มีร้านสะดวกซื้อใกล้ ๆ คุ้มค่ากับราคาที่จ่าย,1,agoda,10/4/2018
R2307,ใกล้แหล่งท่องเที่ยว ห้องพักสะอาดมาก มาพักช่วงวันหยุดยาว แนะนำสำหรับคนที่มาเที่ยวพัทยา,1,agoda,9/16/2021
R2308,มีทางเดินริมทะเล เข้าพักระหว่างเดินทางธุรกิจ กลับมาพักอีกแน่นอน อาหารเช้ามีให้เลือกเยอะ,1,agoda,10/24/2024
R2309,แอร์เย็นไว วิวทะเลจากห้องพักสวยมาก คุ้มค่ากับราคาที่จ่าย พาครอบครัวมาพักผ่อน,1,agoda,11/13/2024
R2310,มีทางเดินริมทะเล คุ้มค่ากับราคาที่จ่าย มาเที่ยวกับเพื่อน ห้องพักสะอาดมาก,1,agoda,9/9/2023
R2311,มาพักก่อนบินวันรุ่งขึ้น เตียงนอนสบาย อยู่ใจกลางเมือง เหมาะกับครอบครัว,1,agoda,3/21/2024
R2312,พาครอบครัวมาพักผ่อน กลับมาพักอีกแน่นอน แม่บ้านทำความสะอาดดีมาก บรรยากาศเงียบสงบ,1,agoda,2/19/2024
R2313,เข้าพักระหว่างเดินทางธุรกิจ บรรยากาศเงียบสงบ มีของใช้ครบในห้องพัก ประทับใจมากโดยรวม,1,agoda,3/17/2022
R2314,คุ้มค่ากับราคาที่จ่าย วิวทะเลจากห้องพักสวยมาก พักเพื่อประชุม แม่บ้านทำความสะอาดดีมาก,0,agoda,12/8/2024
R2315,มาพักช่วงวันหยุดยาว สามารถเดินไปห้างได้ อาหารเช้ามีให้เลือกเยอะ กลับมาพักอีกแน่นอน,1,agoda,7/27/2021
R2316,ถือเป็นตัวเลือกที่ดี ห้องพักสะอาดมาก จองห้องกระทันหัน สามารถเดินไปห้างได้,1,agoda,10/28/2020
R2317,เข้าพักระหว่างเดินทางธุรกิจ ถือเป็นตัวเลือกที่ดี แม่บ้านทำความสะอาดดีมาก เดินทางสะดวก,1,agoda,10/22/2020
R2318,แอร์เย็นไว ประทับใจมากโดยรวม วิวทะเลจากห้องพักสวยมาก แวะพักระหว่างขับรถทางไกล,1,agoda,1/12/2022
R2319,มาพักก่อนบินวันรุ่งขึ้น ประทับใจมากโดยรวม มีร้านสะดวกซื้อใกล้ ๆ มีของใช้ครบในห้องพัก,1,agoda,11/18/2022
R2320,พักเพื่อประชุม มีร้านสะดวกซื้อใกล้ ๆ คุ้มค่ากับราคาที่จ่าย ห้องพักสะอาดมาก,1,agoda,8/6/2022
R2321,แวะพักระหว่างขับรถทางไกล พนักงานสุภาพและบริการดี ถือเป็นตัวเลือกที่ดี บรรยากาศเงียบสงบ,1,agoda,9/18/2022
R2322,มาเที่ยวกับเพื่อน ห้องพักสะอาดมาก ประทับใจมากโดยรวม บรรยากาศเงียบสงบ,1,agoda,12/16/2023
R2323,เหมาะกับครอบครัว แวะพักระหว่างขับรถทางไกล สามารถเดินไปห้างได้ พนักงานสุภาพและบริการดี,1,agoda,11/4/2020
R2324,ห้องพักสะอาดมาก เข้าพักระหว่างเดินทางธุรกิจ จะบอกต่อเพื่อน ๆ แน่นอน เดินทางสะดวก,1,agoda,8/3/2023
R2325,แม่บ้านทำความสะอาดดีมาก อยู่ใจกลางเมือง กลับมาพักอีกแน่นอน มาพักก่อนบินวันรุ่งขึ้น,1,agoda,7/3/2020
R2326,ประทับใจมากโดยรวม มาพักช่วงวันหยุดยาว อยู่ใจกลางเมือง ห้องพักสะอาดมาก,1,agoda,10/27/2025
R2327,แวะพักระหว่างขับรถทางไกล ประทับใจมากโดยรวม บรรยากาศเงียบสงบ การเช็คอินรวดเร็ว,1,agoda,11/4/2020
R2328,ถือเป็นตัวเลือกที่ดี อยู่ใจกลางเมือง มีของใช้ครบในห้องพัก มาเที่ยวกับเพื่อน,1,agoda,5/10/2020
R2329,มีโอกาสจะกลับมาพักอีก อาหารเช้ามีให้เลือกเยอะ ใกล้แหล่งท่องเที่ยว มาเที่ยวกับเพื่อน,1,agoda,1/17/2018
R2330,พาครอบครัวมาพักผ่อน เหมาะกับครอบครัว วิวทะเลจากห้องพักสวยมาก แม่บ้านทำความสะอาดดีมาก,1,agoda,10/22/2020
R2331,กลับมาพักอีกแน่นอน วิวทะเลจากห้องพักสวยมาก อาหารเช้ามีให้เลือกเยอะ มาพักช่วงวันหยุดยาว,1,agoda,6/19/2020
R2332,อาหารเช้ามีให้เลือกเยอะ กลับมาพักอีกแน่นอน สามารถเดินไปห้างได้ มาพักก่อนบินวันรุ่งขึ้น,1,agoda,1/7/2022
R2333,จองห้องกระทันหัน แนะนำสำหรับคนที่มาเที่ยวพัทยา ใกล้แหล่งท่องเที่ยว พนักงานสุภาพและบริการดี,1,agoda,1/13/2019
R2334,อยู่ใจกลางเมือง เข้าพักระหว่างเดินทางธุรกิจ แอร์เย็นไว มีโอกาสจะกลับมาพักอีก,1,agoda,7/28/2023
R2335,มีโอกาสจะกลับมาพักอีก การเช็คอินรวดเร็ว พักเพื่อประชุม มีร้านสะดวกซื้อใกล้ ๆ,1,agoda,1/16/2021
R2336,ประทับใจมากโดยรวม เตียงนอนสบาย บรรยากาศเงียบสงบ แวะพักระหว่างขับรถทางไกล,1,agoda,11/10/2025
R2337,แวะพักระหว่างขับรถทางไกล อาหารเช้ามีให้เลือกเยอะ ใกล้แหล่งท่องเที่ยว เหมาะกับครอบครัว,1,agoda,7/12/2019
R2338,แวะพักระหว่างขับรถทางไกล แนะนำสำหรับคนที่มาเที่ยวพัทยา มีทางเดินริมทะเล พนักงานสุภาพและบริการดี,1,agoda,6/23/2018
R2339,อาหารเช้ามีให้เลือกเยอะ ใกล้แหล่งท่องเที่ยว จองห้องกระทันหัน ประทับใจมากโดยรวม,1,agoda,11/25/2020
R2340,ประทับใจมากโดยรวม แอร์เย็นไว จองห้องกระทันหัน มีทางเดินริมทะเล,1,agoda,1/29/2022
R2341,มีทางเดินริมทะเล แวะพักระหว่างขับรถทางไกล เตียงนอนสบาย จะบอกต่อเพื่อน ๆ แน่นอน,1,agoda,8/12/2022
R2342,วิวทะเลจากห้องพักสวยมาก การเช็คอินรวดเร็ว มาเที่ยวกับเพื่อน แนะนำสำหรับคนที่มาเที่ยวพัทยา,1,agoda,2/20/2025
R2343,เข้าพักระหว่างเดินทางธุรกิจ มีทางเดินริมทะเล พนักงานสุภาพและบริการดี มีโอกาสจะกลับมาพักอีก,1,agoda,4/21/2020
R2344,พักเพื่อประชุม มีของใช้ครบในห้องพัก เดินทางสะดวก จะบอกต่อเพื่อน ๆ แน่นอน,1,agoda,8/16/2022
R2345,เข้าพักระหว่างเดินทางธุรกิจ เหมาะกับครอบครัว มีของใช้ครบในห้องพัก วิวทะเลจากห้องพักสวยมาก,1,agoda,11/3/2024
R2346,คุ้มค่ากับราคาที่จ่าย บรรยากาศเงียบสงบ มาพักก่อนบินวันรุ่งขึ้น แม่บ้านทำความสะอาดดีมาก,1,agoda,4/23/2020
R2347,ถือเป็นตัวเลือกที่ดี มาพักก่อนบินวันรุ่งขึ้น ใกล้แหล่งท่องเที่ยว มีของใช้ครบในห้องพัก,1,agoda,2/22/2024
R2348,มาเที่ยวกับเพื่อน มีโอกาสจะกลับมาพักอีก บรรยากาศเงียบสงบ พนักงานสุภาพและบริการดี,1,agoda,9/13/2025
R2349,การเช็คอินรวดเร็ว พาครอบครัวมาพักผ่อน อยู่ใจกลางเมือง คุ้มค่ากับราคาที่จ่าย,0,agoda,2/17/2021
R2350,มีทางเดินริมทะเล มีของใช้ครบในห้องพัก มีโอกาสจะกลับมาพักอีก มาพักก่อนบินวันรุ่งขึ้น,1,agoda,5/6/2020
R2351,จองห้องกระทันหัน เตียงนอนสบาย คุ้มค่ากับราคาที่จ่าย วิวทะเลจากห้องพักสวยมาก,1,agoda,2/22/2021
R2352,การเช็คอินรวดเร็ว แนะนำสำหรับคนที่มาเที่ยวพัทยา วิวทะเลจากห้องพักสวยมาก แวะพักระหว่างขับรถทางไกล,1,agoda,8/15/2021
R2353,อาหารเช้ามีให้เลือกเยอะ มาเที่ยวกับเพื่อน ใกล้แหล่งท่องเที่ยว จะบอกต่อเพื่อน ๆ แน่นอน,1,agoda,10/27/2020
R2354,พาครอบครัวมาพักผ่อน มีทางเดินริมทะเล มีโอกาสจะกลับมาพักอีก แอร์เย็นไว,0,agoda,5/8/2021
R2355,อาหารเช้ามีให้เลือกเยอะ พักเพื่อประชุม คุ้มค่ากับราคาที่จ่าย อยู่ใจกลางเมือง,1,agoda,7/8/2022
R2356,ประทับใจมากโดยรวม เข้าพักระหว่างเดินทางธุรกิจ แม่บ้านทำความสะอาดดีมาก มีร้านสะดวกซื้อใกล้ ๆ,1,agoda,8/7/2020
R2357,กลับมาพักอีกแน่นอน มีทางเดินริมทะเล มาเที่ยวกับเพื่อน แอร์เย็นไว,1,agoda,2/19/2024
R2358,แอร์เย็นไว กลับมาพักอีกแน่นอน เดินทางสะดวก มาพักก่อนบินวันรุ่งขึ้น,1,agoda,3/8/2022
R2359,มีทางเดินริมทะเล จองห้องกระทันหัน กลับมาพักอีกแน่นอน เตียงนอนสบาย,1,agoda,1/3/2024
R2360,ประทับใจมากโดยรวม วิวทะเลจากห้องพักสวยมาก มาเที่ยวกับเพื่อน การเช็คอินรวดเร็ว,1,agoda,3/12/2021
R2361,วิวทะเลจากห้องพักสวยมาก มาพักก่อนบินวันรุ่งขึ้น เตียงนอนสบาย กลับมาพักอีกแน่นอน,1,agoda,6/16/2021
R2362,แวะพักระหว่างขับรถทางไกล อยู่ใจกลางเมือง แอร์เย็นไว ประทับใจมากโดยรวม,1,agoda,3/14/2021
R2363,จองห้องกระทันหัน เตียงนอนสบาย คุ้มค่ากับราคาที่จ่าย ใกล้แหล่งท่องเที่ยว,1,agoda,3/15/2023
R2364,มาพักก่อนบินวันรุ่งขึ้น เดินทางสะดวก ถือเป็นตัวเลือกที่ดี แม่บ้านทำความสะอาดดีมาก,0,agoda,3/11/2024
R2365,มีทางเดินริมทะเล แวะพักระหว่างขับรถทางไกล แนะนำสำหรับคนที่มาเที่ยวพัทยา เตียงนอนสบาย,1,agoda,9/15/2023
R2366,อาหารเช้ามีให้เลือกเยอะ มาเที่ยวกับเพื่อน แนะนำสำหรับคนที่มาเที่ยวพัทยา สามารถเดินไปห้างได้,1,agoda,7/22/2021
R2367,การเช็คอินรวดเร็ว แวะพักระหว่างขับรถทางไกล เดินทางสะดวก เหมาะกับครอบครัว,1,agoda,9/16/2022
R2368,ถือเป็นตัวเลือกที่ดี มาเที่ยวกับเพื่อน การเช็คอินรวดเร็ว วิวทะเลจากห้องพักสวยมาก,1,agoda,6/14/2022
R2369,เข้าพักระหว่างเดินทางธุรกิจ ประทับใจมากโดยรวม ใกล้แหล่งท่องเที่ยว ห้องพักสะอาดมาก,1,agoda,11/3/2022
R2370,แนะนำสำหรับคนที่มาเที่ยวพัทยา อาหารเช้ามีให้เลือกเยอะ มีร้านสะดวกซื้อใกล้ ๆ เข้าพักระหว่างเดินทางธุรกิจ,1,agoda,10/13/2020
R2371,สามารถเดินไปห้างได้ เข้าพักระหว่างเดินทางธุรกิจ กลับมาพักอีกแน่นอน มีของใช้ครบในห้องพัก,1,agoda,11/22/2024
R2372,เตียงนอนสบาย มีโอกาสจะกลับมาพักอีก พักเพื่อประชุม ใกล้แหล่งท่องเที่ยว,1,agoda,1/21/2024
R2373,การเช็คอินรวดเร็ว พาครอบครัวมาพักผ่อน อยู่ใจกลางเมือง ถือเป็นตัวเลือกที่ดี,1,agoda,7/19/2021
R2374,กลับมาพักอีกแน่นอน มาพักช่วงวันหยุดยาว เดินทางสะดวก แม่บ้านทำความสะอาดดีมาก,1,agoda,9/3/2020
R2375,การเช็คอินรวดเร็ว มีทางเดินริมทะเล มาเที่ยวกับเพื่อน คุ้มค่ากับราคาที่จ่าย,1,agoda,12/21/2018
R2376,มีทางเดินริมทะเล มีโอกาสจะกลับมาพักอีก พาครอบครัวมาพักผ่อน ห้องพักสะอาดมาก,1,agoda,3/20/2018
R2377,มาพักช่วงวันหยุดยาว การเช็คอินรวดเร็ว สามารถเดินไปห้างได้ จะบอกต่อเพื่อน ๆ แน่นอน,1,agoda,3/14/2024
R2378,จะบอกต่อเพื่อน ๆ แน่นอน ห้องพักสะอาดมาก บรรยากาศเงียบสงบ จองห้องกระทันหัน,1,agoda,3/15/2025
R2379,มีโอกาสจะกลับมาพักอีก แม่บ้านทำความสะอาดดีมาก แวะพักระหว่างขับรถทางไกล ใกล้แหล่งท่องเที่ยว,1,agoda,11/24/2024
R2380,พักเพื่อประชุม การเช็คอินรวดเร็ว มีโอกาสจะกลับมาพักอีก ใกล้แหล่งท่องเที่ยว,1,agoda,5/16/2023
R2381,คุ้มค่ากับราคาที่จ่าย แอร์เย็นไว วิวทะเลจากห้องพักสวยมาก จองห้องกระทันหัน,1,agoda,5/6/2018
R2382,มาพักก่อนบินวันรุ่งขึ้น มีโอกาสจะกลับมาพักอีก มีร้านสะดวกซื้อใกล้ ๆ อาหารเช้ามีให้เลือกเยอะ,1,agoda,5/18/2020
